Date,Description,Amount,Type,Label
2024-09-30,pension Ago ask common big.,76946.21,CR,Income
2024-07-28,TERM DEPOSIT Call alone year.,723.4,DR,Savings
2024-08-23,FD MATURITY Visit everyone.,4756.07,DR,Savings
2024-12-21,electricity bill Paper act imagine a.,11012.95,DR,Expense
2025-02-09,pension Free million test.,5915.79,DR,Savings
2024-07-02,salary from Onto safe grow.,66230.49,CR,Income
2025-01-11,amazon Assume price scene.,5593.82,DR,Expense
2024-11-05,fuel Camera course.,15009.48,DR,Expense
2025-03-27,CREDITED BY Side middle play.,75727.74,CR,Income
2024-10-29,gift received Idea protect inside.,21762.04,Credit,Income
2024-09-10,EQUITY INVESTMENT Animal course coach.,5020.09,DR,Savings
2024-12-06,fuel They likely ago.,8488.88,DR,Expense
2025-02-22,RD interest Develop fact after.,23603.74,CR,Income
2025-01-11,BAJAJ ALLIANZ Federal thing leave.,5868.8,DR,Savings
2024-07-22,zomato Move on former same.,4564.16,DR,Expense
2024-12-21,zomato Carry thank trip.,11476.42,DR,Expense
2024-11-22,paytm Really order phone.,16172.57,DR,Expense
2025-01-20,zomato Everything music.,14262.79,DR,Expense
2025-06-04,fuel Environmental push.,5349.78,DR,Expense
2024-07-22,scholarship Feel item kind lose.,27977.28,Credit,Income
2025-03-01,royalty Manage however.,62314.65,Credit,Income
2025-05-09,amazon Her more west city.,16654.96,DR,Expense
2025-01-22,UPI credit Why worry fall near.,72608.12,Credit,Income
2024-09-02,reimbursement credit Listen church stage.,50758.09,Credit,Income
2025-01-03,RTGS credit Than improve.,52712.16,Credit,Income
2025-01-31,award Beat century know.,13266.33,Credit,Income
2025-02-14,NPS Back blue each.,5836.25,DR,Savings
2025-04-28,sale proceeds The necessary next.,67008.94,Credit,Income
2024-12-23,RENT RECEIVED Take simple it.,31035.32,CR,Income
2024-09-24,paytm Mention fund system.,5728.09,DR,Expense
2024-08-19,FD INTEREST CREDIT Free whose six.,1129.09,DR,Savings
2024-10-08,paytm To citizen six.,7650.98,DR,Expense
2024-10-24,grocery Why middle live.,4642.52,DR,Expense
2024-09-29,emi Man stand certainly.,5594.31,DR,Expense
2025-03-21,dividend credit Phone when campaign.,16925.23,CR,Income
2024-12-30,final settlement Would you dinner.,60662.4,Credit,Income
2025-05-13,MIRAE ASSET Series health pick.,6686.56,DR,Savings
2025-01-25,BAJAJ ALLIANZ Listen law.,7928.41,DR,Savings
2025-02-20,fuel Focus five citizen.,13933.35,DR,Expense
2024-07-16,rent Figure quality.,9237.11,DR,Expense
2024-09-05,bonus received Skill night tax.,8522.85,Credit,Income
2025-04-24,SIP DEBIT Role thank above.,4784.98,DR,Savings
2025-02-11,reversal Car end old plant.,16265.46,CR,Income
2025-05-14,elss Education include.,4033.4,DR,Savings
2025-06-29,food World speech race.,15308.42,DR,Expense
2024-09-12,paytm Citizen shoulder.,19772.03,DR,Expense
2024-08-06,fuel Outside more.,984.27,DR,Expense
2025-06-05,NPS Be movie also over.,1693.68,DR,Savings
2024-07-23,DIGITAL GOLD Until opportunity.,3176.22,DR,Savings
2025-02-19,emi Cell season mention.,15399.48,DR,Expense
2024-07-17,BONUS RECEIVED Pretty example.,40121.36,Credit,Income
2024-09-30,icici pru Part resource plan.,5022.73,DR,Savings
2024-11-05,amazon Ball available.,15320.98,DR,Expense
2025-01-06,loan credit Painting film world.,16685.15,CR,Income
2025-05-16,salary transfer Them effort try.,50635.96,Credit,Income
2024-09-16,CREDIT FROM Success thing oil.,54735.72,Credit,Income
2025-01-24,KVP Change green suffer.,6431.28,DR,Savings
2025-03-28,RD CREDIT Look feel too.,1526.28,DR,Savings
2025-06-28,amazon Question democratic.,9606.86,DR,Expense
2024-08-19,swiggy Although describe.,16782.18,DR,Expense
2024-09-04,ZERODHA Want hard unit.,783.64,DR,Savings
2024-08-03,zomato Everything hundred.,12225.42,DR,Expense
2024-10-14,emi American give nice.,13590.34,DR,Expense
2025-01-19,salary from How suddenly.,24287.9,CR,Income
2024-12-03,emi Medical teacher.,19597.57,DR,Expense
2025-04-25,ppf Ability color half.,7917.93,DR,Savings
2024-07-16,electricity bill Against moment.,8821.43,DR,Expense
2025-03-07,FD interest Director data want.,70525.79,Credit,Income
2024-11-02,fuel Office tend here.,17966.31,DR,Expense
2024-10-31,sip Thank eat situation.,3983.12,DR,Savings
2025-06-11,amazon Finally phone admit.,12465.17,DR,Expense
2025-05-10,food Quality cost nation.,8342.55,DR,Expense
2024-11-18,AUTO TRANSFER TO RD System have detail.,939.93,DR,Savings
2024-09-21,RENT RECEIVED Camera again.,75345.54,Credit,Income
2024-09-18,sale proceeds Both fund expect.,73922.89,Credit,Income
2024-12-01,grocery Place indicate.,19932.12,DR,Expense
2025-04-11,rent Them personal.,12113.36,DR,Expense
2025-03-22,FD BOOKING South consumer.,4873.15,DR,Savings
2024-11-06,food Interest stay.,11172.79,DR,Expense
2024-07-26,fuel Senior score.,17271.78,DR,Expense
2024-08-12,KVP Meet treat task and.,1756.24,DR,Savings
2024-07-10,sale credit Happy prevent feel.,55774.63,Credit,Income
2025-04-25,fuel Enough already item.,3922.13,DR,Expense
2024-11-09,shopping Far land develop.,16021.47,DR,Expense
2024-12-06,TRANSFER FROM Prove hundred gas.,10805.0,CR,Income
2025-04-23,grocery Involve question.,15290.49,DR,Expense
2025-05-10,pension In once during can.,9661.1,CR,Income
2024-07-21,grocery Field hospital.,5518.75,DR,Expense
2025-04-18,NIPPON INDIA Moment industry.,6335.42,DR,Savings
2025-04-08,amazon Later crime.,19785.03,DR,Expense
2024-11-06,paytm Voice team.,4001.22,DR,Expense
2025-06-27,REFUND It program certain.,31839.06,CR,Income
2024-08-31,grocery Throw star.,17549.06,DR,Expense
2024-12-25,SALARY CREDITED Total finish really.,12575.43,CR,Income
2025-02-03,tax refund Page future simple.,73853.49,Credit,Income
2025-02-20,fuel Government low.,16655.64,DR,Expense
2024-12-04,fuel Every you yes.,17278.5,DR,Expense
2025-05-30,DIVIDEND RECEIVED Change believe me.,34945.83,CR,Income
2025-06-09,grocery Each number.,6933.42,DR,Expense
2025-03-10,zomato Simply five support.,3910.76,DR,Expense
2025-04-14,BONUS RECEIVED Teach require.,42014.65,Credit,Income
2024-11-03,rent received For effect word.,36573.52,CR,Income
2024-11-24,HDFC LIFE Concern support.,5500.46,DR,Savings
2025-06-02,LIC Perform notice.,4087.15,DR,Savings
2024-10-03,zomato Conference.,4138.88,DR,Expense
2025-01-29,LIFE INSURANCE Eye sign economic.,5910.53,DR,Savings
2024-07-03,electricity bill Hope might sell.,14360.65,DR,Expense
2025-01-29,swiggy Expect present.,11953.2,DR,Expense
2024-08-19,CREDITED BY Agent town threat.,72140.33,CR,Income
2024-08-05,amazon Also article design.,6265.17,DR,Expense
2025-04-11,salary credit Detail candidate.,30926.14,CR,Income
2025-01-30,final settlement Truth character.,36046.44,Credit,Income
2025-01-14,amazon Score upon model.,17383.43,DR,Expense
2024-07-04,electricity bill Simple appear see.,12458.1,DR,Expense
2024-12-20,SGB PURCHASE Race drop fish.,7854.84,DR,Savings
2024-11-04,advance credit Popular.,77835.23,Credit,Income
2024-10-12,scholarship Employee brother we.,12771.74,Credit,Income
2024-07-27,amazon Computer smile.,17204.73,DR,Expense
2024-08-18,amazon Best order result I.,11302.07,DR,Expense
2025-05-09,paytm Magazine answer.,8431.23,DR,Expense
2024-09-10,zomato Bar cut adult.,9071.04,DR,Expense
2025-01-14,reversal Perform candidate.,9525.45,CR,Income
2025-05-22,grocery As not room.,15226.2,DR,Expense
2025-02-07,emi Beautiful her safe.,6782.59,DR,Expense
2024-12-23,credited Knowledge card sure.,68764.83,CR,Income
2024-08-18,incentive Someone same leader.,40823.26,Credit,Income
2024-11-10,AXIS BLUECHIP How girl sometimes.,8230.65,DR,Savings
2024-12-20,shopping All outside more.,12338.04,DR,Expense
2025-04-28,zomato Stage moment.,18877.63,DR,Expense
2025-01-01,FD BOOKING People population.,1905.15,DR,Savings
2025-05-21,GOLD BOND Over long act by.,6545.31,DR,Savings
2024-08-28,fuel Center first writer.,1740.78,DR,Expense
2024-11-30,nps Laugh simple firm.,739.91,DR,Savings
2024-11-19,swiggy Laugh ago run.,8588.75,DR,Expense
2024-10-23,emi Huge north.,9706.18,DR,Expense
2025-06-11,fuel Future face why.,15937.45,DR,Expense
2024-07-22,amazon Art another itself.,19764.03,DR,Expense
2025-01-07,food Only art rather.,10806.42,DR,Expense
2025-02-27,zomato Draw future artist.,2452.3,DR,Expense
2025-05-22,pension Kitchen possible.,69012.45,CR,Income
2024-10-02,FD OPENING Report city last.,7330.95,DR,Savings
2024-09-14,rent Fill interesting.,14897.81,DR,Expense
2025-06-13,salary payment Teacher only just.,29135.49,CR,Income
2024-12-31,zomato Success each.,7360.97,DR,Expense
2025-04-15,food Base teacher.,14801.09,DR,Expense
2025-04-09,refund Film authority.,43658.53,CR,Income
2024-08-24,RENT RECEIVED Tonight yeah truth.,56338.6,CR,Income
2024-09-18,RECURRING PAY Small improve.,2659.58,DR,Savings
2024-07-14,dividend payout Guess short hour.,61456.61,CR,Income
2025-03-15,salary Teacher although.,71684.52,CR,Income
2025-02-06,zomato Smile level.,2855.43,DR,Expense
2024-12-25,amazon Prevent anyone.,13011.28,DR,Expense
2025-05-21,ACH/NEFT from Something maintain.,14169.16,CR,Income
2024-07-21,amazon Over reduce let.,14080.09,DR,Expense
2025-04-17,rent Leg open decide.,4869.19,DR,Expense
2025-05-27,paytm Indicate him hope.,8019.26,DR,Expense
2024-10-15,food Claim ground tell.,8586.58,DR,Expense
2024-08-14,emi Project over room.,3794.48,DR,Expense
2025-04-30,salary credited Around evidence.,5851.79,CR,Income
2024-10-04,rent received Save worry later.,46614.37,CR,Income
2025-03-02,SIP DEBIT Fire respond of.,2065.16,DR,Savings
2024-11-27,shopping Difference much.,19534.24,DR,Expense
2025-02-24,CREDIT FROM Charge cup make.,61010.13,CR,Income
2024-11-07,nps Watch huge center.,8129.87,DR,Savings
2025-01-16,MUTUAL FUND Meeting investment.,8893.68,DR,Savings
2024-10-20,nps Throughout risk.,1668.4,DR,Savings
2025-02-04,credited Deep put safe any.,7355.56,CR,Income
2025-06-28,grocery Once base social.,229.89,DR,Expense
2024-10-17,zomato Institution build.,11587.45,DR,Expense
2024-10-06,cash deposit Watch alone record.,54502.48,Credit,Income
2024-12-05,pension Weight future.,69434.42,Credit,Income
2025-05-22,NATIONAL PENSION SYSTEM Big energy reduce.,7040.8,DR,Savings
2024-10-26,paytm Foot bit until.,12536.3,DR,Expense
2025-06-19,grocery Center baby my her.,17228.84,DR,Expense
2025-02-24,nps Perform trip theory.,8043.66,DR,Savings
2024-11-21,electricity bill Benefit at street.,7127.37,DR,Expense
2024-10-23,RENT RECEIVED Design civil thing.,58100.49,Credit,Income
2024-10-16,paytm Four drug heart set.,7032.16,DR,Expense
2024-11-08,CREDITED Fight PM game.,77002.98,CR,Income
2025-03-27,payment from Read peace white.,40986.56,Credit,Income
2025-06-27,food Arm month fire to.,12418.85,DR,Expense
2025-04-06,paytm Central rich care.,19598.48,DR,Expense
2025-04-25,amazon Type blue most.,4700.11,DR,Expense
2024-07-22,final settlement Culture work they.,41204.81,CR,Income
2025-05-26,zomato Both until society.,15163.94,DR,Expense
2024-09-19,FRANKLIN TEMPLETON Account see travel.,4092.93,DR,Savings
2024-12-24,SALARY CREDITED Project agree least.,59993.4,CR,Income
2024-12-14,electricity bill Hear true seem.,13704.49,DR,Expense
2024-11-14,amazon Yard alone single.,17327.15,DR,Expense
2025-01-20,AUTO TRANSFER TO RD Claim anything.,4482.75,DR,Savings
2025-03-08,electricity bill Begin others whose.,14931.56,DR,Expense
2024-08-28,bonus received Scientist.,7888.99,CR,Income
2024-09-30,reimbursement Bar leg shoulder.,60640.07,Credit,Income
2025-01-14,INVESTMENT FUND Agree down feeling.,5366.69,DR,Savings
2025-04-23,payment from Type head job reach.,70245.66,CR,Income
2025-02-14,award Court serve occur.,27191.72,CR,Income
2025-01-07,FD MATURITY Kind season realize.,625.47,DR,Savings
2025-01-24,electricity bill These him and tough.,8277.4,DR,Expense
2025-03-04,grocery American kitchen.,13208.42,DR,Expense
2025-06-29,cashback Claim beautiful.,42830.8,CR,Income
2024-10-13,SAVINGS DEPOSIT Make instead every.,4075.61,DR,Savings
2025-05-26,AUTO TRANSFER TO RD Middle news party.,2087.02,DR,Savings
2025-03-05,INVESTMENT TRANSFER Watch wear among.,3536.9,DR,Savings
2025-04-03,REFUND Situation per poor.,59433.25,CR,Income
2025-01-29,BAJAJ ALLIANZ Edge fly point.,622.2,DR,Savings
2025-05-07,rent No add politics.,18447.87,DR,Expense
2024-08-12,rent Forget adult order.,7820.76,DR,Expense
2025-04-07,amazon A good building.,9244.53,DR,Expense
2025-03-14,rent Friend camera color.,14055.19,DR,Expense
2025-03-24,paytm Carry sea threat.,16379.34,DR,Expense
2024-10-12,INTEREST CREDIT Certain center seat.,47216.06,Credit,Income
2024-09-03,SALARY DEPOSIT Sport sea full.,37827.55,Credit,Income
2025-03-29,emi Executive glass.,18460.83,DR,Expense
2024-10-18,SAVINGS DEPOSIT Much the half form.,8317.38,DR,Savings
2024-11-07,swiggy Themselves market.,2251.7,DR,Expense
2025-01-07,ppf Mean doctor.,4286.79,DR,Savings
2024-10-21,CREDITED BY Coach fear our fund.,68381.79,Credit,Income
2025-05-30,bonus received Wonder free stay.,79208.76,Credit,Income
2025-02-15,electricity bill Condition future.,13666.07,DR,Expense
2024-11-21,ICICI PRU MF Door sit argue.,4063.98,DR,Savings
2025-04-12,EQUITY Any professor Mrs.,3725.42,DR,Savings
2024-11-19,shopping Chair part nature.,14337.13,DR,Expense
2024-07-28,reimbursement credit Expert pattern miss.,70969.77,Credit,Income
2024-11-28,HDFC LIFE Part them it item.,3099.84,DR,Savings
2024-09-29,SGB PURCHASE Decision side.,515.88,DR,Savings
2025-06-24,ACH/NEFT credit My agency whatever.,65316.06,Credit,Income
2025-01-10,zomato Political economy.,13706.28,DR,Expense
2025-02-25,royalty Movement that data.,9114.66,Credit,Income
2024-10-17,fuel Boy suddenly.,19740.48,DR,Expense
2025-06-30,grocery Leave create born.,14686.41,DR,Expense
2024-11-02,rent Project detail late.,10547.81,DR,Expense
2025-06-17,food Crime listen make.,12012.5,DR,Expense
2024-11-27,amazon Data pretty its bag.,14179.47,DR,Expense
2024-10-25,ANGEL ONE Really into still.,8155.24,DR,Savings
2024-10-31,ACH/NEFT credit Bad knowledge force.,20649.86,CR,Income
2025-05-04,SAVINGS Money serve state.,2535.91,DR,Savings
2024-10-29,ICICI PRU LIFE Today maintain life.,2461.79,DR,Savings
2025-03-26,bonus received Reduce interesting.,69786.79,CR,Income
2025-06-16,PREMIUM PAID Little Democrat.,7644.56,DR,Savings
2025-06-29,SSY ACCOUNT Sometimes play.,3265.66,DR,Savings
2025-04-28,electricity bill Across woman wife.,16018.04,DR,Expense
2024-11-02,paytm Where draw.,4208.82,DR,Expense
2025-02-21,food On defense drug.,9860.5,DR,Expense
2024-07-31,DIVIDEND RECEIVED Inside religious.,64489.64,CR,Income
2024-11-29,CREDITED Real pull decide.,58514.95,Credit,Income
2025-05-23,zomato Lay fast debate.,7295.8,DR,Expense
2025-01-03,emi Certain return.,7698.19,DR,Expense
2024-09-27,rent Claim material good.,17521.95,DR,Expense
2024-09-11,MUTUAL FUND Option memory bit.,7735.22,DR,Savings
2024-09-17,shopping During treat firm.,15800.8,DR,Expense
2025-06-15,final settlement Central before.,44590.25,CR,Income
2024-10-19,fuel Executive word.,12632.8,DR,Expense
2024-08-16,electricity bill Through environment.,5352.91,DR,Expense
2024-10-05,INSURANCE PREMIUM Chance art heart.,7578.61,DR,Savings
2024-09-08,sip Can sense available.,2834.03,DR,Savings
2024-07-07,rent Song knowledge.,12276.44,DR,Expense
2024-12-24,GOLD ETF Move write item.,9286.58,DR,Savings
2025-02-11,swiggy Several game eye.,14567.6,DR,Expense
2024-07-03,paytm Nor down commercial.,13541.2,DR,Expense
2024-12-16,fuel Involve tonight box.,16227.32,DR,Expense
2024-09-18,fuel Something color.,15596.19,DR,Expense
2025-01-16,TATA AIA About hundred at.,3234.26,DR,Savings
2024-07-05,zomato Mouth reason.,11705.28,DR,Expense
2024-07-12,grocery Trial hundred.,7455.52,DR,Expense
2024-09-20,maturity proceeds Up father community.,48039.27,Credit,Income
2025-05-08,food Else ten number.,18284.55,DR,Expense
2025-06-25,expense claim Design moment.,32815.56,CR,Income
2025-05-31,bonus Structure back.,22558.72,CR,Income
2024-09-27,emi Situation fine case.,6117.91,DR,Expense
2025-04-16,zomato Thing image score.,2393.85,DR,Expense
2025-04-04,DEMAT Point we student.,5707.04,DR,Savings
2024-11-09,amazon Onto about improve.,6708.43,DR,Expense
2025-01-26,interest Whose suffer per.,79349.87,Credit,Income
2025-05-14,food Prove raise for.,11761.41,DR,Expense
2025-05-16,amazon Feel artist woman.,391.71,DR,Expense
2024-10-18,paytm Marriage meeting.,6928.19,DR,Expense
2024-10-15,stipend Reflect enter.,5132.09,CR,Income
2025-04-25,FD DEPOSIT Middle food result.,8891.74,DR,Savings
2024-12-13,electricity bill Reflect owner image.,11568.75,DR,Expense
2025-03-14,ICICI PRU MF Something agency.,3112.0,DR,Savings
2024-07-24,rent Ball require miss.,10522.31,DR,Expense
2025-04-19,fuel Traditional rise.,14638.34,DR,Expense
2024-08-30,swiggy Factor herself.,8751.76,DR,Expense
2025-03-08,rent Word center learn.,2387.98,DR,Expense
2024-08-23,maturity proceeds Matter front.,67395.21,CR,Income
2024-11-15,arrears Understand item.,11748.0,Credit,Income
2024-10-12,sip Share set nature.,6282.84,DR,Savings
2024-09-22,rent Data vote purpose.,5978.72,DR,Expense
2024-08-24,amazon Station realize.,12381.12,DR,Expense
2025-02-06,NIPPON INDIA General treat coach.,9708.83,DR,Savings
2025-04-17,SALARY DEPOSIT Us sort tonight.,23991.26,Credit,Income
2024-07-10,zomato Now million wall.,17338.86,DR,Expense
2024-08-30,electricity bill Course important.,14197.45,DR,Expense
2025-02-03,AUTO TRANSFER TO RD Well not impact Mrs.,1693.83,DR,Savings
2025-05-17,RECURRING DEPOSIT Door last.,3388.92,DR,Savings
2024-09-29,CREDIT FROM Tonight player.,61040.02,Credit,Income
2025-03-05,swiggy These head event.,13103.05,DR,Expense
2024-11-11,food Step economic.,18710.82,DR,Expense
2024-09-19,consulting payment Return finally.,65825.04,CR,Income
2025-06-16,RTGS credit Pattern cultural.,58347.8,Credit,Income
2025-03-20,emi Culture decade.,18007.5,DR,Expense
2025-04-06,SBI BLUECHIP Current speech ok.,4390.8,DR,Savings
2025-03-11,award Program room during.,62844.65,CR,Income
2024-08-09,REIMBURSEMENT Issue every lawyer.,65906.68,CR,Income
2024-07-24,REIMBURSEMENT So growth white.,64957.21,Credit,Income
2025-06-13,CREDITED Song within.,32203.12,CR,Income
2024-12-17,salary deposit Property newspaper.,50959.73,Credit,Income
2024-11-28,zomato Support commercial.,19596.56,DR,Expense
2025-02-13,scholarship Never must anything.,76783.35,CR,Income
2024-12-02,swiggy Administration miss.,4958.64,DR,Expense
2025-03-04,fuel Use court pass.,13010.31,DR,Expense
2024-11-03,fuel Those not support.,2112.16,DR,Expense
2025-04-20,LIC Certainly job.,3736.54,DR,Savings
2025-04-09,REIMBURSEMENT Now on through fish.,73214.62,CR,Income
2024-09-12,sale proceeds Development.,12443.57,CR,Income
2025-05-31,credited Fly be possible.,17044.17,CR,Income
2024-07-14,swiggy Respond threat.,11917.48,DR,Expense
2024-08-12,rent Mind question.,9273.12,DR,Expense
2024-11-05,advance payment Their will list.,67761.42,CR,Income
2024-11-22,pension Do nature impact.,7681.04,DR,Savings
2025-03-01,electricity bill Employee like.,12814.31,DR,Expense
2024-10-17,swiggy Television finish.,8876.39,DR,Expense
2024-11-01,salary transfer Save art wish two.,40622.29,Credit,Income
2024-12-04,rent Maybe health which.,2226.69,DR,Expense
2024-12-28,zomato Image customer low.,19551.9,DR,Expense
2025-01-31,zomato President keep lose.,17093.59,DR,Expense
2024-08-03,fuel After brother.,9431.24,DR,Expense
2024-07-14,NSC Level human staff.,4560.55,DR,Savings
2024-07-29,employer credit Purpose color.,12735.5,CR,Income
2025-01-05,INTEREST CREDIT Long ever together.,33968.93,Credit,Income
2024-11-20,RENT RECEIVED Practice simple.,39796.33,Credit,Income
2025-04-04,electricity bill Try trip modern.,11033.29,DR,Expense
2025-01-13,paytm Man three work.,10266.2,DR,Expense
2024-12-09,amazon Could major out.,10266.14,DR,Expense
2025-06-23,rent College list from.,5846.86,DR,Expense
2025-02-11,food East still thus.,7476.02,DR,Expense
2025-02-09,food Service ability as.,17154.92,DR,Expense
2025-02-03,cash deposit Mr behavior most.,15318.19,CR,Income
2025-04-17,electricity bill Responsibility real.,11540.45,DR,Expense
2025-01-15,PUBLIC PROVIDENT FUND Recent appear huge.,3956.96,DR,Savings
2024-10-10,salary from Compare character.,7601.12,Credit,Income
2025-06-15,insurance claim Recently tree left.,75190.97,Credit,Income
2024-09-16,INVESTMENT Near happen example.,8690.66,DR,Savings
2024-07-20,employer credit Product take free.,24114.83,Credit,Income
2025-02-13,dividend Card because stage.,13715.3,Credit,Income
2025-03-02,salary transfer Officer music like.,38770.65,CR,Income
2024-08-17,FD OPENING Among professional.,4642.6,DR,Savings
2025-04-18,AUTO TRANSFER TO RD Respond town.,7448.06,DR,Savings
2025-01-17,FD DEPOSIT System old drug.,573.95,DR,Savings
2025-04-28,HDFC LIFE Positive success.,2306.42,DR,Savings
2024-12-24,electricity bill Summer study.,15597.8,DR,Expense
2025-04-18,paytm Feeling week star.,9848.83,DR,Expense
2024-09-27,tax refund Husband open.,24241.6,Credit,Income
2024-11-23,food Yes phone occur.,7914.39,DR,Expense
2025-03-26,insurance claim Director owner.,59875.78,CR,Income
2024-11-28,emi Last policy college.,4807.46,DR,Expense
2024-07-25,HDFC LIFE Opportunity usually.,5811.72,DR,Savings
2025-03-26,food Fine administration.,2863.58,DR,Expense
2025-04-17,FD BOOKING As morning worry.,5967.76,DR,Savings
2024-07-15,IMPS credit Special try catch.,14363.59,Credit,Income
2024-11-11,fuel Hear skin once.,8500.49,DR,Expense
2024-09-22,CREDITED Group debate agency.,23910.32,Credit,Income
2025-06-11,CREDIT FROM Explain exactly.,30658.76,Credit,Income
2024-12-22,SGB INVESTMENT Imagine collection.,7038.58,DR,Savings
2025-05-21,reimbursement Site that involve.,25046.55,Credit,Income
2025-06-10,fuel Consider training.,1358.94,DR,Expense
2025-05-20,paytm Might community.,2284.89,DR,Expense
2025-01-17,NSC Partner fear could.,4521.01,DR,Savings
2025-05-15,FD INTEREST CREDIT Guy court join.,9681.84,DR,Savings
2024-10-03,zomato Until some human.,12342.68,DR,Expense
2024-07-30,consulting payment Community region.,41406.04,CR,Income
2025-03-03,food Although finally.,18559.0,DR,Expense
2025-02-20,online transfer Task center reflect.,63580.83,Credit,Income
2024-08-17,amazon Scene research.,7621.67,DR,Expense
2024-09-26,emi Receive modern.,871.24,DR,Expense
2024-07-31,REIMBURSEMENT Age effect indeed.,40545.55,CR,Income
2025-04-12,PPF Live beautiful.,5806.63,DR,Savings
2024-12-16,rent Including the.,17663.85,DR,Expense
2025-05-28,CREDIT FROM Who near produce.,31369.19,Credit,Income
2025-01-25,DIVIDEND RECEIVED Technology manager.,57623.27,Credit,Income
2025-04-25,fuel As arm me marriage.,10959.7,DR,Expense
2025-01-09,shopping Human help process.,8564.72,DR,Expense
2025-03-16,online transfer Want necessary.,54088.52,Credit,Income
2025-03-23,amazon Film together once.,14345.65,DR,Expense
2025-06-23,NSC Certain back think.,1321.69,DR,Savings
2024-09-07,grocery Carry call pick.,9240.0,DR,Expense
2024-10-03,tax refund Talk market.,40475.63,CR,Income
2025-05-01,swiggy Approach have focus.,19313.06,DR,Expense
2025-03-17,emi Structure laugh.,8289.9,DR,Expense
2024-09-29,shopping Some area toward.,13458.17,DR,Expense
2025-02-08,grocery Among artist.,18792.46,DR,Expense
2025-05-14,grocery Property mind.,4930.61,DR,Expense
2025-03-03,grocery Whole medical.,14062.16,DR,Expense
2024-07-30,rent Understand threat.,11905.56,DR,Expense
2024-11-10,emi Cut evidence.,5472.95,DR,Expense
2024-09-26,swiggy Model difficult.,6841.7,DR,Expense
2025-06-08,IMPS credit Consumer last.,66850.07,CR,Income
2025-05-07,cash deposit Wrong game check.,74930.21,Credit,Income
2025-01-10,shopping Put time effort.,5133.9,DR,Expense
2024-11-29,RECURRING DEPOSIT Too something turn.,9842.56,DR,Savings
2024-10-16,SALARY DEPOSIT Indicate job need.,36719.63,Credit,Income
2024-10-01,emi Trip majority the.,1398.35,DR,Expense
2025-02-18,emi Admit position upon.,1215.21,DR,Expense
2025-03-25,loan credit Son computer bag.,24807.25,CR,Income
2024-10-01,emi Really production.,3030.67,DR,Expense
2024-07-03,RTGS credit Example top.,25814.66,Credit,Income
2024-12-30,emi Tough consumer.,12445.68,DR,Expense
2025-05-15,RD Never newspaper.,1195.83,DR,Savings
2025-01-31,amazon Part responsibility.,11095.01,DR,Expense
2024-07-07,sale credit Loss performance.,34863.38,CR,Income
2024-12-19,fuel Want table approach.,520.04,DR,Expense
2024-07-29,EQUITY INVESTMENT Change always soon.,6076.86,DR,Savings
2025-03-29,FD interest Customer evening.,55824.12,CR,Income
2025-03-02,HDFC LIFE Thousand civil.,603.17,DR,Savings
2024-11-02,zomato Parent else without.,14771.99,DR,Expense
2025-03-28,cash deposit Cost word people.,53076.18,Credit,Income
2024-09-04,emi Audience side among.,13112.64,DR,Expense
2024-11-20,mutual fund redemption Audience who oil.,9036.02,Credit,Income
2025-03-19,insurance payout Season concern fire.,46556.81,Credit,Income
2025-02-05,bank transfer Education remember.,17712.29,Credit,Income
2024-07-05,REFUND Realize child.,31590.85,CR,Income
2024-09-12,fuel Though expert.,15865.41,DR,Expense
2025-05-30,electricity bill Minute cost true by.,17802.11,DR,Expense
2024-08-15,final settlement Song nor break.,29987.12,CR,Income
2024-10-13,emi Democrat benefit.,6258.21,DR,Expense
2025-01-04,fd Model Mr field.,8123.49,DR,Savings
2024-11-21,CREDITED TO Care situation.,8754.77,Credit,Income
2025-03-01,fuel Study book together.,2356.02,DR,Expense
2025-03-27,CREDITED TO State rest science.,16351.75,Credit,Income
2025-01-19,SHAREKHAN Edge degree accept.,7986.68,DR,Savings
2024-11-14,food Prevent control.,14155.06,DR,Expense
2025-05-04,food Spend between.,19335.75,DR,Expense
2025-01-29,credited Research skill.,60761.47,Credit,Income
2024-09-08,electricity bill House born one.,1596.91,DR,Expense
2025-04-08,shopping Would ten cost.,17251.99,DR,Expense
2025-04-01,DEBIT FOR INVESTMENT Student response.,9684.41,DR,Savings
2024-09-07,shopping Have hit executive.,19504.45,DR,Expense
2025-07-02,grocery Leader also own.,3903.91,DR,Expense
2025-06-20,incentive Sister wall thing.,65008.15,Credit,Income
2025-01-17,MUTUAL FUND PURCHASE Owner yeah short.,535.53,DR,Savings
2024-09-29,DEMAT Firm find everybody.,9302.1,DR,Savings
2024-07-28,shopping End ask rise this.,17788.82,DR,Expense
